{
  "$schema": "./packages/virage-core/schemas/virage.config.schema.json",
  "chunkers": [
    { "patterns": ["**/*.md", "**/*.mdx"], "strategy": "markdownHeaders" },
    { "patterns": ["src/**/*.ts", "src/**/*.tsx"], "strategy": "token" },
    { "patterns": ["**/*.yaml", "**/*.yml"], "strategy": "wholeFile" }
  ],
  "embedder": {
    "package": "@vivantel/virage-embedder-fastembed",
    "config": {
      "model": "BAAI/bge-large-en-v1.5"
    }
  },
  "vectorStore": {
    "package": "@vivantel/virage-store-postgres",
    "config": {
      "connectionString": "${DATABASE_URL}",
      "dimensions": 1024
    }
  },
  "options": {
    "chunksFile": "./docs/rag/chunks.json",
    "embeddingsFile": "./docs/rag/embeddings.json"
  }
}
